<?xml version="1.0" encoding="utf-8"?>
<attacks xmlns:xsi="http://www.w3.org/2001/XMLSchema-instance" xsi:noNamespaceSchemaLocation="../lang-attacks.xsd">
	<attack id="1">Wrap</attack>
	<attack id="2">Hyper Beam</attack>
	<attack id="3">Dark Pulse</attack>
	<attack id="4">Sludge</attack>
	<attack id="5">Vice Grip</attack>
	<attack id="6">Flame Wheel</attack>
	<attack id="7">Megahorn</attack>
	<attack id="8">Flamethrower</attack>
	<attack id="9">Dig</attack>
	<attack id="10">Cross Chop</attack>
	<attack id="11">Psybeam</attack>
	<attack id="12">Earthquake</attack>
	<attack id="13">Stone Edge</attack>
	<attack id="14">Ice Punch</attack>
	<attack id="15">Heart Stamp</attack>
	<attack id="16">Discharge</attack>
	<attack id="17">Flash Cannon</attack>
	<attack id="18">Drill Peck</attack>
	<attack id="19">Ice Beam</attack>
	<attack id="20">Blizzard</attack>
	<attack id="21">Heat Wave</attack>
	<attack id="22">Aerial Ace</attack>
	<attack id="23">Drill Run</attack>
	<attack id="24">Petal Blizzard</attack>
	<attack id="25">Mega Drain</attack>
	<attack id="26">Bug Buzz</attack>
	<attack id="27">Poison Fang</attack>
	<attack id="28">Night Slash</attack>
	<attack id="29">Bubble Beam</attack>
	<attack id="30">Submission</attack>
	<attack id="31">Low Sweep</attack>
	<attack id="32">Aqua Jet</attack>
	<attack id="33">Aqua Tail</attack>
	<attack id="34">Seed Bomb</attack>
	<attack id="35">Psyshock</attack>
	<attack id="36">Ancient Power</attack>
	<attack id="37">Rock Tomb</attack>
	<attack id="38">Rock Slide</attack>
	<attack id="39">Power Gem</attack>
	<attack id="40">Shadow Sneak</attack>
	<attack id="41">Shadow Punch</attack>
	<attack id="42">Ominous Wind</attack>
	<attack id="43">Shadow Ball</attack>
	<attack id="44">Magnet Bomb</attack>
	<attack id="45">Iron Head</attack>
	<attack id="46">Parabolic Charge</attack>
	<attack id="47">Thunder Punch</attack>
	<attack id="48">Thunder</attack>
	<attack id="49">Thunderbolt</attack>
	<attack id="50">Twister</attack>
	<attack id="51">Dragon Pulse</attack>
	<attack id="52">Dragon Claw</attack>
	<attack id="53">Disarming Voice</attack>
	<attack id="54">Draining Kiss</attack>
	<attack id="55">Dazzling Gleam</attack>
	<attack id="56">Moonblast</attack>
	<attack id="57">Play Rough</attack>
	<attack id="58">Cross Poison</attack>
	<attack id="59">Sludge Bomb</attack>
	<attack id="60">Sludge Wave</attack>
	<attack id="61">Gunk Shot</attack>
	<attack id="62">Bone Club</attack>
	<attack id="63">Bulldoze</attack>
	<attack id="64">Mud Bomb</attack>
	<attack id="65">Signal Beam</attack>
	<attack id="66">X-Scissor</attack>
	<attack id="67">Flame Charge</attack>
	<attack id="68">Flame Burst</attack>
	<attack id="69">Fire Blast</attack>
	<attack id="70">Brine</attack>
	<attack id="71">Water Pulse</attack>
	<attack id="72">Scald</attack>
	<attack id="73">Hydro Pump</attack>
	<attack id="74">Psychic</attack>
	<attack id="75">Psystrike</attack>
	<attack id="76">Icy Wind</attack>
	<attack id="77">Giga Drain</attack>
	<attack id="78">Fire Punch</attack>
	<attack id="79">Solar Beam</attack>
	<attack id="80">Leaf Blade</attack>
	<attack id="81">Power Whip</attack>
	<attack id="82">Air Cutter</attack>
	<attack id="83">Hurricane</attack>
	<attack id="84">Brick Break</attack>
	<attack id="85">Swift</attack>
	<attack id="86">Horn Attack</attack>
	<attack id="87">Stomp</attack>
	<attack id="88">Hyper Fang</attack>
	<attack id="89">Body Slam</attack>
	<attack id="90">Rest</attack>
	<attack id="91">Struggle</attack>
	<attack id="92">Fury Cutter</attack>
	<attack id="93">Bug Bite</attack>
	<attack id="94">Bite</attack>
	<attack id="95">Sucker Punch</attack>
	<attack id="96">Dragon Breath</attack>
	<attack id="97">Thunder Shock</attack>
	<attack id="98">Spark</attack>
	<attack id="99">Low Kick</attack>
	<attack id="100">Karate Chop</attack>
	<attack id="101">Ember</attack>
	<attack id="102">Wing Attack</attack>
	<attack id="103">Peck</attack>
	<attack id="104">Lick</attack>
	<attack id="105">Shadow Claw</attack>
	<attack id="106">Vine Whip</attack>
	<attack id="107">Razor Leaf</attack>
	<attack id="108">Mud Shot</attack>
	<attack id="109">Ice Shard</attack>
	<attack id="110">Frost Breath</attack>
	<attack id="111">Quick Attack</attack>
	<attack id="112">Scratch</attack>
	<attack id="113">Tackle</attack>
	<attack id="114">Pound</attack>
	<attack id="115">Cut</attack>
	<attack id="116">Poison Jab</attack>
	<attack id="117">Acid</attack>
	<attack id="118">Psycho Cut</attack>
	<attack id="119">Rock Throw</attack>
	<attack id="120">Metal Claw</attack>
	<attack id="121">Bullet Punch</attack>
	<attack id="122">Water Gun</attack>
	<attack id="123">Splash</attack>
	<attack id="124">Mud-Slap</attack>
	<attack id="125">Zen Headbutt</attack>
	<attack id="126">Confusion</attack>
	<attack id="127">Poison Sting</attack>
	<attack id="128">Bubble</attack>
	<attack id="129">Feint Attack</attack>
	<attack id="130">Steel Wing</attack>
	<attack id="131">Fire Fang</attack>
	<attack id="132">Rock Smash</attack>
</attacks>